title,date,url,content,parsed_date,year,month,year_month,region,districts,sentiment_score,positive_count,negative_count,sentiment_label
강남3구·용산 빼고 규제 확 푼다…“거래절벽 다소 완화될듯”,2023.01.02 19:19,https://www.joongang.co.kr/article/25130696,"정부가 서울 강남 3구와 용산구만 남기고 부동산 규제지역을 모두 푼다. 여권 고위 관계자는 2일 ""강남·서초·송파구 등 강남 3구와 용산구를 제외하고 부동산 관련 규제를 몽땅 다 풀 것""이라고 말했다. 문재인 정부 때 부동산 급등세를 막기 위해 내놨던 각종 규제를 대거 푸는 것으로, 투기지역·투기과열지구·조정대상지역 등 규제지역 전면 해제가 유력하다.",2023-01-02,2023,1,2023-01,송파구,송파구,-0.6,1,4,부정
"""강남 새 아파트 수난시대""…전셋값 폭락에 입주권도 10억 뚝",2023.01.03 17:05,https://www.joongang.co.kr/article/25130942,"새 아파트에 입주할 수 있는 입주권 가격이 인근 기존 아파트보다 낮은 가격에 거래되고, 전셋집 역시 기존 아파트 전셋값보다 낮게 계약되는 경우가 잇따른다. 3일 국토교통부 실거래가 공개시스템에 따르면 다음 달 말 입주를 시작하는 서울 강남구 개포동 개포자이프레지던스(옛 개포주공 4단지) 전용면적 84㎡ 입주권이 최고 거래가(2021년 11월 29억5000만원)보다 10억원 가까이 떨어진 20억원에 거래된 것으로 확인됐다. 오는 11월 입주 예정인 개포동 디에이치퍼스티어아이파크(옛 개포주공 1단지) 전용 84㎡의 입주권 가격도 지난해 4월 29억3000만원에 거래됐던 것이 7개월 만인 11월 23억원까지 내렸다.",2023-01-03,2023,1,2023-01,강남구,강남구,0.0,1,1,중립
강남·용산 외 부동산 규제 푼다,2023.01.03 00:18,https://www.joongang.co.kr/article/25130779,"정부가 서울 강남 3구와 용산구만 남기고 부동산 규제지역을 모두 푼다. 여권 고위 관계자는 2일 ""강남·서초·송파구 등 강남 3구와 용산구를 제외하고 부동산 관련 규제를 몽땅 다 풀 것""이라고 말했다. 문재인 정부 때 부동산 급등세를 막기 위해 내놨던 각종 규제를 대거 푸는 것으로, 투기지역·투기과열지구·조정대상지역 등 규제지역 전면 해제가 유력하다.",2023-01-03,2023,1,2023-01,송파구,송파구,-0.5,1,3,부정
서울서 4번째 ‘입지 끝판왕’…한강 780m 품은 신반포 2차유료 전용,2023.01.03 16:35,https://www.joongang.co.kr/article/25130929,"한강 변에 위치한 서울 서초구 잠원동 신반포2차아파트의 김영일 재건축조합장에게 아파트의 장점에 관해 묻자 이렇게 답했습니다. 재건축을 해도 한 개 동 이상이 들어설 수 없는데, 박원순 전 시장 시절인 2015년 만들어진 서울시 도시기본계획 2030플랜에서는 한강 변 첫 주동(한강 변에서 가장 가까운 아파트 동)의 높이를 15층 이하로 제시하고 있습니다. 최근 서울시의회가 신통기획에 참여한 재건축 단지의 경우 시공사 선정을 기존 사업시행인가 이후에서 조합 설립 이후로 앞당기는 개정 조례안을 통과하면서 조합은 시공사 선정도 준비 중입니다.",2023-01-03,2023,1,2023-01,서초구,서초구,1.0,1,0,긍정
"입주권 10억 뚝, 전셋값 하락…강남 신축 아파트도 꺾였다",2023.01.04 00:02,https://www.joongang.co.kr/article/25131030,"새 아파트에 입주할 수 있는 입주권 가격이 인근 기존 아파트보다 낮은 가격에 거래되고, 전셋집 역시 기존 아파트 전셋값보다 낮게 계약되는 경우가 잇따른다. 3일 국토교통부 실거래가 공개시스템에 따르면 다음 달 말 입주를 시작하는 서울 강남구 개포동 개포자이프레지던스(옛 개포주공 4단지) 전용면적 84㎡ 입주권이 최고 거래가(2021년 11월 29억5000만원)보다 10억원 가까이 떨어진 20억원에 거래된 것으로 확인됐다. 오는 11월 입주 예정인 개포동 디에이치퍼스티어아이파크(옛 개포주공 1단지) 전용 84㎡의 입주권 가격도 지난해 4월 29억3000만원에 거래됐던 것이 7개월 만인 11월 23억원까지 내렸다.",2023-01-04,2023,1,2023-01,강남구,강남구,0.0,1,1,중립
'영끌족 꿈' 헬리오시티 추락…'넉달새 4억' 잇단 손절매 쇼크,2023.01.07 05:00,https://www.joongang.co.kr/article/25131829,국토부 실거래가공개시스템에 올라온 지난해 12월 헬리오시티 84㎡ 거래 4건 중 두 건이 위의 초단기 손절매다. 중개업소들에 따르면 지난해 7월 처음으로 손절매가 나오기 시작해 가팔라진 집값 하락세와 맞물려 10월부터 잇따랐다. 국토부 실거래가공개시스템에 따르면 잠실동 일대 ‘엘리트’(잠실엘스·리센츠·트리지움)와 헬리오시티 거래량이 토지거래허가구역 지정 전·후 뒤바뀌었다.,2023-01-07,2023,1,2023-01,송파구,송파구,-1.0,0,1,부정
‘평당 1억’ 아리팍 후광효과…금리쇼크도 견딘 신반포2차유료 전용,2023.01.10 14:26,https://www.joongang.co.kr/article/25132526,"이 단지 재건축조합이 서울시의 신속통합기획(신통기획)에 합류하기로 결정한 이후 토지거래허가구역에 묶인 것도 이런 거래 가뭄의 원인이 됐습니다. 신반포1차를 2016년 재건축한 아크로리버파크가 한강 변 아파트의 가치를 높이면서 가격 상승을 이끌었고, 이 효과로 반포 지역 일대 아파트값이 ‘키 맞추기’를 했다는 설명입니다. 이 단지에서 영업 중인 한 공인중개사는 ""단지 인근의 신반포4차의 경우 신통기획 합류가 무산되면서 급매물이나 경매 물건이 출회되고 있지만, 이 단지는 이렇다 할 움직임이 감지되고 있지 않다""고 말합니다.",2023-01-10,2023,1,2023-01,서초구,서초구,0.3333333333333333,2,1,긍정
"7년새 2배 껑충 ""10억 더 간다""...고금리도 이긴 이 아파트 비결",2023.01.11 00:17,https://www.joongang.co.kr/article/25132695,"이 단지와 같은 해(1978년)에 지어진 송파구 잠실동 잠실주공5단지의 동일 면적(34평) 가격인 9억3000만원(7층)과 1억원 정도 차이를 보였다. 입주 초기 아크로리버파크 34평형(전용면적 84㎡)의 실거래 가격은 22억원(최고가 기준) 수준이었다. 서초구가 소유한 단지 북측의 땅을 아파트 대지에 포함해 계산해 보면 재건축 시 조합이 부담해야 할 임대아파트는 300가구 이상에서 263가구 수준으로 줄고, 조합원은 27평형(전용 64㎡) 이상의 아파트를 배정받을 수 있을 것으로 보인다.",2023-01-11,2023,1,2023-01,서초구,"서초구, 송파구",0.3333333333333333,2,1,긍정
"왕년엔 압구정 한양 맞먹었다, 마포 대장주 벼르는 성산시영유료 전용",2023.01.17 14:47,https://www.joongang.co.kr/article/25134291,"지난 16일 서울 마포구 성산동 성산시영아파트 단지에서 만난 주민 최모(65)씨 얘기입니다. 안전진단은 재건축 사업의 첫 관문으로 ‘아파트가 너무 낡고 불편해 새로 지어야 한다’고 공인받는 절차입니다. 그 결과 주거환경(10점 만점 중 9.3점)과 개발 호재(6.8점), 단지 규모(6.6점), 대중교통(6.5점) 등은 높은 점수를 받았지만 교육(3.4점)과 주변 신축도(4.2점) 점수는 비교적 낮았습니다.",2023-01-17,2023,1,2023-01,강남구,강남구,1.0,3,0,긍정
"폭락의 중심에서 '바닥'을 외치다?…""잠실, 거래 늘고 하락 멈춰""",2023.01.21 06:00,https://www.joongang.co.kr/article/25135263,"지난 19일 서울 송파구 잠실동 일대에서 만난 공인중개사들은 잠실 대단지 아파트를 중심으로 최근 거래가 늘고 하락이 사실상 멈춘 상태라고 입을 모았다. 잠실엘스 전용 84㎡는 2021년 10월 27억원(14층)까지 거래됐던 것이 지난해 9월 처음 심리적 지지 가격인 20억원 밑으로 떨어졌고, 지난해 10월 19억원(11층)까지 하락했다. 윤지해 부동산R114 수석연구원은 ""송파, 강동, 노원 등 2021년 가격이 크게 올랐다가 조정이 일찍 시작돼 큰 폭의 하락세를 보인 지역 중심으로 거래량이 늘고 있다""며 ""수요자가 수용 가능한 가격 선까지 가격이 내려가면서 매수 심리가 회복되고 거래가 이뤄지는 것""이라고 설명했다.",2023-01-21,2023,1,2023-01,송파구,송파구,-0.2,2,3,부정
토지거래허가구역도 풀릴까…재지정 결정 앞두고 시장 촉각,2023.01.24 17:30,https://www.joongang.co.kr/article/25135570,"서울시는 2020년 6월 국제교류복합지구 및 인근 지역인 강남구 청담·대치·삼성동, 송파구 잠실동을 토지거래허가구역으로 지정한 데 이어, 이듬해인 2021년 4월에는 주요 재건축 단지가 밀집한 강남구 압구정동, 영등포구 여의도동, 성동구 성수동, 양천구 목동 일대를 토지거래허가구역으로 묶었다. 영등포구 여의도동의 재건축 아파트 단지 16곳의 경우 2021년 132건이 거래됐지만, 지난해 거래는 32건에 불과했다. 송파구 잠실동의 한 공인중개사는 ""집값이 크게 떨어진 지금을 갭투자 적기라고 생각하는 대기수요가 늘고 있다""며 ""만약 6월에 잠실동이 토지거래허가구역에서 해제될 경우 집값이 1~2억원은 뛸 것""이라고 예상했다.",2023-01-24,2023,1,2023-01,강남구,"강남구, 송파구",1.0,2,0,긍정
규제 완화에 설연휴 '반강제 관망'...서울 집값 하락폭 4주째 축소,2023.01.26 14:44,https://www.joongang.co.kr/article/25136083,"26일 한국부동산원에 따르면 이번 주(23일 기준) 서울 아파트값은 일주일 전보다 0.31% 내렸다. 서울 25개 구 아파트값을 보면 강남구가 0.11% 하락하며 지난주(-0.25%) 대비 낙폭이 크게 줄었다. 반면 강서구(-0.66%)와 금천구(-0.55%), 강동구(-0.47%), 성동구(-0.31%) 등은 전주보다 하락 폭이 커졌다.",2023-01-26,2023,1,2023-01,강남구,강남구,-1.0,0,2,부정
"""90년대엔 압구정급 집값"" 규제완화에 확 달라진 이 아파트 [돈 버는 아파트 완전정복]",2023.01.27 00:15,https://www.joongang.co.kr/article/25136256,"1990년 1월 기준 성산시영 전용면적 51㎡가 7000만원대, 강남구 압구정동 한양1차 전용 50㎡는 7500만원 정도였습니다. 성산시영이 투자 유망 아파트로 본격적으로 관심을 받은 건 2014년 ‘9·1 부동산 대책’ 발표 이후 수혜 단지로 꼽히면서입니다. 이 덕에 2014년 이 아파트 전용 50㎡ 매매가는 1년 만에 20%가량 올랐습니다.",2023-01-27,2023,1,2023-01,강남구,강남구,0.0,1,1,중립
1·3대책 이후 급매물은 팔리는데…매도·매수 '눈치싸움' 극심,2023.01.29 17:30,https://www.joongang.co.kr/article/25136656,"""집주인이 호가를 낮춘 급매물만 조금씩 팔려요"".(서울 마포구 공인중개사)  ""거래가 성사되고 가격도 다시 오릅니다"".(서울 송파구 공인중개사)    대대적인 부동산 규제 완화책이 담긴 ‘1·3 대책’ 이후 서울 아파트 매매시장이 미세하게 변화하고 있다. 서울부동산정보광장에 따르면 서울 아파트 거래량(신고일 기준)은 지난해 10월 559건으로 역대 최저치를 기록한 뒤 3개월 연속 증가세다. 한국부동산원 조사 결과 지난 23일 기준 서울 아파트값은 전주 대비 0.31% 하락해 1·3 대책 이후 낙폭이 3주 연속 축소됐다.",2023-01-29,2023,1,2023-01,송파구,송파구,-0.5,1,3,부정
급매물은 조금씩 손바뀜…부동산시장 빙하기 끝나나,2023.01.30 00:03,https://www.joongang.co.kr/article/25136726,"""집주인이 호가를 낮춘 급매물만 조금씩 팔려요"".(서울 마포구 공인중개사)    ""거래가 성사되고 가격도 다시 오릅니다"".(서울 송파구 공인중개사)    대대적인 부동산 규제 완화책이 담긴 ‘1·3 대책’ 이후 서울 아파트 매매시장이 미세하게 변화하고 있다. 서울부동산정보광장에 따르면 서울 아파트 거래량(신고일 기준)은 지난해 10월 559건으로 역대 최저치를 기록한 뒤 3개월 연속 증가세다. 한국부동산원 조사 결과 지난 23일 기준 서울 아파트값은 전주 대비 0.31% 하락해 1·3 대책 이후 낙폭이 3주 연속 축소됐다.",2023-01-30,2023,1,2023-01,송파구,송파구,-1.0,0,2,부정
“엄청난 부의 이동 온다” 압구정 재건축의 모든 것유료 전용,2023.01.31 14:38,https://www.joongang.co.kr/article/25137205,"준공 반세기를 바라보는 압구정 아파트 단지들은 현재 6개 특별계획구역으로 나눠 재건축 사업을 진행하고 있습니다. 87년까지 14차에 이르는 현대아파트가 건설됐고, 한양건설이 시공한 한양아파트까지 들어서면서 압구정동 일대는 1만 가구 규모의 대형 아파트 단지로 탈바꿈합니다. 압구정동 아파트 단지 재건축 사업은 2016년 10월 서울시가 ‘압구정 아파트지구 지구단위계획’이란 이름의 개발 청사진을 내놨습니다.",2023-01-31,2023,1,2023-01,강남구,강남구,1.0,2,0,긍정
"전세가율 11년 만에 최저…""전셋값 급락, 집값 더 끌어내릴 것""",2023.02.05 17:38,https://www.joongang.co.kr/article/25138361,"전용 84㎡ 기준 서울 아파트의 매매 대비 전셋값 차는 평균 7억여 원 수준으로 벌어진 것이다. 9510가구 규모의 서울 송파구 가락동 헬리오시티의 전용면적 84㎡의 경우 KB시세(일반평균가)를 기준으로 지난해 9월 초만 해도 전세가율이 55~56%(매매 시세 21억, 전세 11억8333만원) 수준이었다. 지난달 25일 한국은행이 공개한 ‘금융·경제 이슈 분석’ 보고서에 따르면 ""최근 주택시장에서 매맷값 하락이 전셋값 하락을 불러오고, 낮아진 전셋값이 다시 매맷값을 끌어내리는 ‘연쇄작용’으로 부진이 심화하고 있다""고 진단했다.",2023-02-05,2023,2,2023-02,송파구,송파구,-1.0,0,2,부정
"압구정 현백을 상가로 쓴다, 평당 1.5억 노리는 ‘신현대’유료 전용",2023.02.07 15:46,https://www.joongang.co.kr/article/25138871,"박합수 건국대 부동산대학원 겸임교수는 ""신현대는 단일 단지로 압구정 지역에서 재건축 추진 속도가 가장 빠르다""며 ""현재 183% 용적률이 300% 남짓으로 변경된다면 35~61평대의 중대형 세대인 신현대는 기존 면적을 조합원분에서 빼지 않고도 일반 분양에 쓸 수 있다""고 했습니다. 그러면서 ""1848가구가 3000가구 수준으로 바뀌면 공공 아파트분을 고려해도 1000가구 가까이가 일반 분양으로 나올 것이고 사업성도 충분히 확보할 수 있다""며 ""신현대도 압구정 재건축의 핵심으로 꼽히는 구현대(3구역) 못지않게 입지가 강화될 역량을 갖춰 충분히 주목해볼 만하다""고 덧붙였습니다. 압구정 현대아파트는 재건축 후 국내 최고가 아파트가 될 것이란 확신과 함께, 건설업계에선 압구정동 아파트 사업을 누가 따내느냐에 따라 앞으로 주택 업계 판도가 뒤바뀔 수 있다는 관측도 나옵니다.",2023-02-07,2023,2,2023-02,강남구,강남구,1.0,2,0,긍정
반포도 13억 내려…서울 집값 6주 만에 다시 하락폭 커졌다,2023.02.09 14:58,https://www.joongang.co.kr/article/25139419,"서울·경기·인천의 아파트값 하락 폭이 6주 만에 다시 커졌다. 지난달 규제지역 해제를 포함한 부동산 대책 발표로 5주 연속 하락 폭이 줄었다가 다시 낙폭이 커진 것이다. 부동산원 관계자는 ""시중금리 완화 기조로 매수 문의와 거래량이 소폭 늘었지만 매도인과 매수인 간 희망가격 격차가 여전히 크다""며 ""급매 위주의 하락 거래가 많은 상황""이라고 설명했다.",2023-02-09,2023,2,2023-02,서초구,서초구,-0.6,1,4,부정
입주권 '100억원'에 팔린 반포 이 아파트…입지 어떻길래,2023.02.10 13:00,https://www.joongang.co.kr/article/25139677,금리 인상의 여파로 부동산 시장이 극도로 침체한 가운데 서울 서초구 반포동 래미안원베일리 펜트하우스가 100억원에 거래됐다. 10일 국토교통부 실거래가 공개시스템에 따르면 이 아파트 전용 200.93㎡가 지난달 16일 100억원(35층)에 손바뀜했다. 이 아파트 전용 84㎡는 지난해 12월 32억원에 팔려 최고가 38억7407만원보다 7억원 가량 하락했다.,2023-02-10,2023,2,2023-02,서초구,서초구,-0.5,1,3,부정
반포 래미안 원베일리 입주권 ‘100억 원’에 팔렸다,2023.02.10 12:51,https://www.joongang.co.kr/article/25139676,"서울 서초구 반포동에 들어서는 ‘래미안원베일리’ 대형 평형 입주권이 100억원에 팔렸다. 이 단지는 서울 지하철 3·7·9호선 고속터미널역과 9호선 신반포역 쿼드러플 역세권에 있다. 당시 책정된 분양가는 역대 최고 수준이었지만, 시장에서는 고속터미널역 3·7·9호선과 선호 학군을 끼고 있는 입지 등으로 당첨시 10~15억원의 시세차익이 예상되는 ‘로또 청약’이라는 기대를 모아왔다.",2023-02-10,2023,2,2023-02,서초구,서초구,1.0,6,0,긍정
‘미니 신도시’ 압구정 재건축…한국판 베벌리 힐스 꿈꾼다유료 전용,2023.02.14 15:03,https://www.joongang.co.kr/article/25140496,"서울시 강남구 압구정 아파트 단지 인근에서 압구정강남공인중개사사무소를 운영 중인 박인구 대표의 말입니다. 박인구 대표는 ""재건축 단지 조합원이 새 아파트 분양권을 얻으려면 2년간 실거주해야 한다는 정부의 규제 방안이 나오면서 압구정 아파트 가격이 급등했다""고 설명합니다. 박인구 대표는 ""선견지명이 있는 집주인들은 일찌감치 자식 몫으로 압구정 아파트 1~2채를 추가로 매입해 놓은 상태""라며 ""압구정 아파트가 1만여 가구인데, 중복 소유주를 제외하면 재건축 조합원은 7000여 명 수준일 것""이라고 말했습니다.",2023-02-14,2023,2,2023-02,강남구,강남구,0.5,3,1,긍정
"외지인이 산 서울 아파트, 동작구·영등포구·서초구 순",2023.02.14 16:01,https://www.joongang.co.kr/article/25140515,"지난해 서울 밖에서 살면서 서울 아파트를 산 사람 중 20%는 동작구·영등포구·서초구를 택했다. 동작구·영등포구·서초구 등에 투자가 집중된 것은 생활 인프라와 도심 접근성이 좋고, 재개발·재건축 등 개발 가능성이 높기 때문으로 분석된다. 부동산업계 관계자는 ""외지인의 서울 아파트 매입은 교통여건, 교육환경, 직장·주거 근접, 생활 인프라, 적정 매매가, 개발 호재 등 다양한 요인이 반영된다""며 ""동작구와 영등포구, 서초구는 재개발·재건축 등의 정비사업으로 지역적인 발전 가능성이 높아 실거주와 투자 두 가지 수요를 흡수한 것으로 보인다""고 말했다.",2023-02-14,2023,2,2023-02,서초구,서초구,1.0,5,0,긍정
"""월세 100만원 넘어도 괜찮아""…서울 소형빌라 거래 급증 이유",2023.02.15 11:36,https://www.joongang.co.kr/article/25140736,"15일 부동산 정보제공업체 경제만랩이 국토교통부 실거래가 공개시스템을 분석한 결과 지난해 서울 소형빌라(전용면적 60㎡ 이하) 월세 거래 4만 3917건 가운데 월세 100만원이 넘는 거래는 6.9%인 3018건이었다. 월세 100만원이 넘는 서울 소형빌라는 2011년부터 2019년까지 매년 1000건을 밑돌다가 2020년 1027건, 2021년 1693건으로 증가하다 지난해 3000건을 넘겼다. 서울 25개 자치구 중 월세 100만원이 넘는 소형빌라 거래가 가장 많은 곳은 강남구(791건)였다.",2023-02-15,2023,2,2023-02,강남구,강남구,0.0,0,0,중립
"'영끌'해서 산 50억 아이파크삼성, 경매도 한번 유찰 돼 결국...",2023.02.17 13:50,https://www.joongang.co.kr/article/25141316,"17일 경매업계에 따르면 지난달 31일 삼성동 아이파크삼성 145㎡가 감정가 50억원에서 한 차례 유찰된 끝에 51억원에 매각됐다. 경매업계 관계자는 ""40억원가량의 대출을 통한 영끌 매수 사례로 볼 수 있다""며 ""1금융권 대출 한도 때문에 대부업체에서 추가 대출을 받았고, 이후 감당을 할 수 없으니 경매로 넘겨졌다""고 말했다. 지난해 12월 은마아파트 84㎡는 27억 9000만원(감정가)에 경매 시장에 나왔지만, 시세보다 높아 두 차례 유찰됐다.",2023-02-17,2023,2,2023-02,강남구,강남구,-0.3333333333333333,1,2,부정
거래 늘고 가격 오른 곳도…집값 바닥 찍었나,2023.02.20 00:03,https://www.joongang.co.kr/article/25141682,"19일 중앙일보가 국토교통부 실거래가 공개시스템을 분석한 결과, 서울 아파트 가운데 집값이 폭락했던 지난해 4분기(10~12월) 최저가보다 올해 1~2월(2월 19일까지 신고건 기준) 최고가가 높은 주택 유형(단지와 전용면적이 동일한)은 72곳으로 나타났다. 서초구 반포동 반포주공1단지 전용 140㎡는 지난해 12월 13일 66억원(5층)에 거래됐는데, 지난달 3일에는 이보다 11억5000만원 낮은 가격(54억5000만원)에 거래됐다. 박합수 건국대 부동산대학원 겸임교수는 ""금융당국이 금융권(은행) 지도를 통해 금리가 떨어지고는 있지만, 최소한 올해 상반기까지는 기준금리 인상이 마무리되지 않을 가능성이 높다""며 ""이에 따라 주택 시장 하락세도 당분간 이어질 것으로 보인다""고 했다.",2023-02-20,2023,2,2023-02,서초구,서초구,-1.0,0,3,부정
"35층 제한 풀렸다, 속도 내는 압구정 재건축",2023.02.20 00:35,https://www.joongang.co.kr/article/25141709,"서울시의 신속통합(신통)기획이 진행 중인 가운데, 서울 아파트 층수를 최고 35층 이하로 일률적으로 제한해 온 일명 ‘35층 룰’이 9년 만에 사라져 재건축 추진에 활기가 다시 돌고 있다. 가장 큰 걸림돌이었던 35층 층수 제한에 막혀 사업성 문제를 해결하지 못하던 3구역은 서울시의 규제 기조가 바뀌면서 재건축 사업에 활기를 띠고 있다. 박합수 교수는 ""압구정동 일대 아파트단지는 교육과 교통, 한강변 입지 때문에 재건축 사업이 진행될수록 가치가 상승할 것""이라며 ""전국 최고의 입지에 입성하기 위한 수요자의 관심이 계속 이어질 것""이라고 전망했다.",2023-02-20,2023,2,2023-02,강남구,강남구,0.5,3,1,긍정
"9년만에 없앤 걸림돌…""엄청난 부 이동"" 부자들 주목한 이곳",2023.02.20 00:39,https://www.joongang.co.kr/article/25141711,"서울시의 신속통합(신통)기획이 진행 중인 가운데, 서울 아파트 층수를 최고 35층 이하로 일률적으로 제한해 온 일명 ‘35층 룰’이 9년 만에 사라져 재건축 추진에 활기가 다시 돌고 있다. 가장 큰 걸림돌이었던 35층 층수 제한에 막혀 사업성 문제를 해결하지 못하던 3구역은 서울시의 규제 기조가 바뀌면서 재건축 사업에 활기를 띠고 있다. 박합수 교수는 ""압구정동 일대 아파트단지는 교육과 교통, 한강변 입지 때문에 재건축 사업이 진행될수록 가치가 상승할 것""이라며 ""전국 최고의 입지에 입성하기 위한 수요자의 관심이 계속 이어질 것""이라고 전망했다.",2023-02-20,2023,2,2023-02,강남구,강남구,0.5,3,1,긍정
"통일보다 어렵단 말 나온다, 구현대 재건축 진짜 난관유료 전용",2023.02.21 14:45,https://www.joongang.co.kr/article/25142086,"이후 압구정 구현대는 국내 최고 부촌 아파트로 자리 잡아 ‘부의 상징’이 됩니다. 하지만 전문가들은 압구정 구현대가 재건축되면 최고 부촌 타이틀을 되찾을 것으로 내다봅니다. 박합수 건국대 부동산대학원 겸임교수는 ""구현대가 재건축되면 낡은 아파트를 떠났던 ‘압구정 키즈’와 그들의 자녀들이 다시 돌아와 살 것""이라며 ""입주 후 최소 3.3㎡당 1억5000만원, 한강 조망 단지는 2억원에 달할 것으로 본다""고 전망했습니다.",2023-02-21,2023,2,2023-02,강남구,강남구,1.0,2,0,긍정
