title,date,url,content,parsed_date,year,month,year_month,region,districts,sentiment_score,positive_count,negative_count,sentiment_label
한강변 1조 재건축도 번번이 유찰…시공사 구하기 힘들다,2024.11.05 00:02,https://www.joongang.co.kr/article/25289493,"4일 건설업계 등에 따르면 서초구 방배동 방배7구역 재건축 조합은 지난 4월과 6월 시공사 선정을 위한 입찰을 진행했는데, 모두 무응찰로 유찰됐다. 조합이 제시한 3.3㎡(평)당 공사비는 약 980만원으로 최근 재건축 시공사 선정 공고를 낸 서초구 잠원동 신반포2차(950만원)와 강남구 개포동 개포주공5단지(840만원)보다 높은 수준이지만, 시공사 선정에 난항을 겪고 있다. 지난 4월과 6월 입찰에 참여한 건설사가 없었고, 지난달 세 번째 입찰에는 롯데건설만 단독 참여하면서 경쟁입찰이 성립되지 않아서다.",2024-11-05,2024,11,2024-11,강남구,"강남구, 서초구",1.0,1,0,긍정
12년만에 서울 그린벨트 푼다…서초·고양·의왕·의정부 5만 가구,2024.11.05 15:00,https://www.joongang.co.kr/article/25289657,"정부가 서울 서초구, 경기 고양·의왕·의정부시 일대 그린벨트(개발제한구역)를 풀어 수도권에 향후 5만 가구 규모의 주택을 공급하겠다고 밝혔다. 정부는 올해 초 그린벨트를 풀어 수도권 신규 택지 2만 가구를 공급하겠다고 밝혔다가 시장 불안이 계속되자 지난 8·8 부동산 대책 때 당초 물량의 4배인 8만 가구(올해 5만 가구·내년 3만 가구) 규모의 신규 택지를 발표하겠다고 예고한 바 있다. 박 교수는 ""신규 택지를 통한 장기 주택 공급을 늘리는 것과 별개로 25~27년 공급 부족분은 3기 신도시 용적률 상향 등을 통해 공급 물량을 늘리는 방안을 검토해야 한다""고 짚었다.",2024-11-05,2024,11,2024-11,서초구,서초구,0.0,1,1,중립
"부동산 불안 심리 안정에 도움...""MB 보금자리주택 참고하라""",2024.11.05 15:06,https://www.joongang.co.kr/article/25289661,"정부가 서울 서초구 서리풀지구 개발제한구역(그린벨트) 해제를 통해 2만 가구 공급하는 등 수도권에 5만 가구 주택공급계획을 5일 발표했다. 부동산 전문가들은 이미 교통망이 잘 갖춰진 서울 도심의 인접 지역에 주택 공급이 이뤄지면서 서울의 주택 공급난 해소에도 긍정적인 효과가 있을 것으로 전망했다. 김효선 NH농협은행 부동산 수석전문위원은 ""서울의 주택 공급량이 부족한 만큼 장기적인 측면에서는 의미가 있을 수는 있겠지만, 결국 속도와 물량이 중요하다""며 ""물량 자체도 너무 적고, 첫 입주 시점도 2031년으로 예상돼 단기적인 효과는 적을 것으로 보인다""고 말했다.",2024-11-05,2024,11,2024-11,서초구,서초구,0.3333333333333333,2,1,긍정
"“내년 집값 1% ↓, 전세값은 1% ↑…수도권·지방 양극화 심화”",2024.11.06 18:03,https://www.joongang.co.kr/article/25290076,"이날 서울 강남구 건설회관에서 열린 세미나에서 주택·부동산 경기 전망을 발표한 김성환 건산연 부연구위원은 ""올해 3분기까지 시장 흐름은 실수요자 중심의 주택 갈아타기가 활발해지면서 매매 거래량이 지난해에 비해 대폭 늘어났고, 직전 대비 상승 거래도 많았다""며 ""기준금리 인하를 선반영한 시장 금리 이하 효과로 수도권을 중심으로 상승세가 나타났다""고 짚었다. 김 부연구위원은 ""내년에도 정부의 가계부채 총량관리 정책은 지속될 것으로 보이고, 전반적인 경기 회복도 더디다""며 ""내년 집값이 올해 같은 가격 상승을 보이기는 어려울 것""이라고 전망했다. 김 부연구위원은 ""수도권, 신축 아파트 선호 현상이 강화되며 수도권과 지방 간 양극화가 심화되고 있다""며 ""서울 내에서도 강남과 외곽 간 격차가 커지는 등 차별화가 심해 집값 등락에 대한 체감도 수요자마다 다른 상황""이라고 말했다.",2024-11-06,2024,11,2024-11,강남구,강남구,0.3333333333333333,2,1,긍정
수도권 공급난 해소 관건은 속도…“MB 보금자리주택 참고를”,2024.11.06 00:01,https://www.joongang.co.kr/article/25289782,"정부가 서울 서초구 서리풀지구 그린벨트(개발제한구역) 해제를 통해 2만 가구를 공급하는 등 수도권에 5만 가구의 주택을 공급하기로 했다. 부동산 전문가들은 이미 교통망이 잘 갖춰진 서울 도심의 인접 지역에 주택 공급이 이뤄지면서 서울의 주택 공급난 해소에도 긍정적인 효과가 있을 것으로 전망했다. 윤지해 부동산R114 수석연구원은 ""서울에 (서초 서리풀지구) 2만 가구는 상징적인 의미가 있는 규모""라면서 ""서초 지역이 평당 7000만원대인데 여기는 토지 수용을 통해 시세보다 저렴한 3000만∼4000만원에 나올 테니 서울 안에서의 수요 분산 효과가 있을 것""이라고 말했다.",2024-11-06,2024,11,2024-11,서초구,서초구,1.0,1,0,긍정
서울 그린벨트 풀었다…서초에 2만가구 공급,2024.11.06 01:02,https://www.joongang.co.kr/article/25289841,"정부가 서울 서초구, 경기도 고양·의왕·의정부시 일대 그린벨트(개발제한구역)를 풀어 수도권에 향후 5만 가구 규모의 주택을 공급하겠다고 밝혔다. 그린벨트를 해제한 이 지역에 아파트를 지어 각기 서울에 2만 가구, 경기도 일대에 3만 가구를 공급하겠다는 계획이다. 정부는 그린벨트 해제 시 용적률을 250%까지 높일 수 있고, 추가 상향도 가능한 만큼 역세권 고밀 개발을 통해 이 지역에 2만 가구를 공급하겠다는 계획이다.",2024-11-06,2024,11,2024-11,서초구,서초구,1.0,1,0,긍정
“내년 집값 1%↓ 전셋값 1%↑…수도권·지방 양극화는 심화”,2024.11.07 00:02,https://www.joongang.co.kr/article/25290160,"이날 서울 강남구 건설회관에서 열린 세미나에서 주택·부동산 경기 전망을 발표한 김성환 건산연 부연구위원은 내년에는 올해 상반기 같은 주택 가격 상승이 재연되긴 어려울 것으로 내다봤다. 김 부연구위원은 ""내년에도 정부의 가계부채 총량관리 정책은 지속될 것으로 보이고, 전반적인 경기 회복도 더디다""며 ""내년 집값이 올해 같은 가격 상승을 보이기는 어려울 것""이라고 전망했다. 상승률 전망치로도 수도권은 내년 연간 1.0% 오르는 반면 지방은 올해보다 하락세가 더 커져 연간 2.0% 내릴 것으로 예상했다.",2024-11-07,2024,11,2024-11,강남구,강남구,0.3333333333333333,2,1,긍정
서울 아파트값 상승 폭 계속 줄어…매물 늘고 거래량은 3분의 1 급감,2024.11.07 14:59,https://www.joongang.co.kr/article/25290311,"한국부동산원이 7일 발표한 11월 첫째 주(4일 기준) 전국 아파트 주간 가격동향조사에 따르면, 이번 주 서울 아파트값은 전주 대비 0.07% 오르며 33주 연속 상승했다. 서울은 강남구(0.18%)가 개포·대치동 구축 아파트 위주로 올라 서울 평균 상승 폭(0.07%)을 크게 웃돌았고, 서초구·성동구(0.14%), 용산구(0.11%)도 일부 단지가 상승세를 보였다. 한국부동산원 관계자는 ""서울은 재건축 및 선호 단지 위주로 거래되는 등 일부 지역은 상승세가 나타나고 있지만, 대출 규제로 인한 매수자 관망세로 매물이 적체되는 등 상승 폭이 지난주 대비 축소했다""고 말했다.",2024-11-07,2024,11,2024-11,강남구,"강남구, 서초구",0.2,3,2,긍정
"""상상 이상 그린벨트 풀렸다""…호가 800만원 찍은 서리풀",2024.11.08 05:00,https://www.joongang.co.kr/article/25290507,"지난 5일 정부가 발표한 그린벨트 해제 구역 가운데 최고 관심은 서초구 서리풀지구(원지동·신원동·염곡동·내곡동·우면동 일대)였다. 또 다른 공인중개사 한모씨는 ""2020년 문재인 정부 시절 주택 공급난 해소를 목적으로 서울 그린벨트 해제를 추진할 당시에도 유력 후보지로 떠오른 적이 있었다""면서 ""이번에 생각했던 규모 이상으로 훨씬 넓은 지역이 해제 구역에 포함됐다""고 덧붙였다. 이 지역에 거주하는 주민 김모씨는 ""청계산입구역 일대 아파트 단지가 있지만 허허벌판에 덩그라니 놓인 ‘외딴 섬’같은 느낌이 있었다""며 ""그린벨트가 해제돼 2만 가구가 입주하면, 인구가 늘고, 인프라가 갖춰지면서 동네가 살아날 것""이라고 말했다.",2024-11-08,2024,11,2024-11,서초구,서초구,1.0,2,0,긍정
고금리에 영끌족 '백기'…서울 아파트 경매건수 9년만에 최다,2024.11.09 07:00,https://www.joongang.co.kr/article/25290750,"경매 진행 건수 가운데 실제 낙찰 건을 비율로 나타낸 낙찰률도 한달 전보다 하락했다. 고금리로 이자 부담을 이기지 못한 집주인이 늘어난 가운데, 대출 한도 축소 등으로 매수 수요가 위축됐기 때문이라는 풀이가 나온다    8일 경·공매 데이터 전문기업 지지옥션이 발표한 ‘2024년 10월 경매동향보고서’에 따르면, 서울 아파트 경매 진행 건수는 380건으로 2015년 4월(401건) 이후 최대치를 나타냈다. 한국부동산원에 따르면 이번 주 서울 아파트값은 강남구(0.18%)가 개포·대치동 구축 아파트 위주로 올라 서울 평균 상승 폭(0.07%)을 크게 웃돌았고, 서초구·성동구(0.14%), 용산구(0.11%)도 평균 이상의 상승 폭을 나타냈다.",2024-11-09,2024,11,2024-11,강남구,"강남구, 서초구",-0.2,2,3,부정
"""돈 없다고? 여기라도 사라"" 스타강사 '빠숑'이 찍은 아파트",2024.11.16 05:00,https://www.joongang.co.kr/article/25292482,"서울 아파트 거래량이 줄고 매물이 쌓이는 게 대표적이다. 김 소장은 ""난 부동산 전망을 하는 사람이 아니라 25년간 개별 아파트만 본 사람""이라며 ""개별 아파트 수요, 가격 전망으로는 한 번도 틀린 적이 없다""고 말했다. 올 들어 21일까지 아파트 거래량이 많은 구(區)도 송파(3472건), 강남(2952건), 성동(2468건) 등 ‘상급지’였고, 가장 많이 팔린 아파트는 송파구 가락동 헬리오시티(319건)였다.",2024-11-16,2024,11,2024-11,송파구,송파구,0.0,0,0,중립
사흘에 한 건꼴 거래되던 성동구 대단지 대출규제 이후 '0건',2024.11.18 05:00,https://www.joongang.co.kr/article/25292734,"17일 중앙일보가 국토교통부 실거래가 공개시스템을 분석(14일 신고 건까지 집계)한 결과, 9월 이후(9~10월) 서울 아파트 거래 건수는 1만422건으로 거래량이 크게 늘었던 지난 6~7월(1만6462건)과 비교해 63.3%가 감소했다. 올해 3월부터 ‘강남 3구(강남·서초·송파구)’와 ‘마용성(마포·용산·성동구)’ 등 상급지를 중심으로 거래가 늘고, 아파트값이 급등세를 보이자 금융당국은 9월부터 대출한도를 줄이는 2단계 스트레스 DSR(총부채원리금상환비율)을 시행하는 등 ‘돈줄 죄기’에 나섰고, 이후 상황이 반전됐다. 서울 자치구별 6~7월 아파트 거래량 대비 9~10월 거래량을 분석해보니, 서초(-77.3%)·광진(-76.7%)·강동(-74.2%)·송파(-72.2%)·성동구(-70.7%) 등 상급지의 거래량 감소 폭이 크게 나타났다.",2024-11-18,2024,11,2024-11,송파구,송파구,-0.3333333333333333,1,2,부정
내년 '공시가'도 시세변동만 반영…집값 뛴 강남은 보유세 오른다,2024.11.19 11:30,https://www.joongang.co.kr/article/25293109,"이날 신한은행이 서울 주요 아파트의 내년도 보유세 추정치를 분석한 결과, 올해 집값이 많이 오른 강남 3구(강남·서초·송파구)는 내년 보유세가 대체로 올해보다 20~30% 늘어나는 것으로 나타났다. 올해 집값 상승 폭이 가팔랐던 서울 서초구 반포동 ‘아크로 리버파크’ 전용면적 84㎡를 가진 1주택자의 경우, 내년 보유세 추정치는 1407만9000원으로 올해(1160만8000원)보다 247만원(21.3%)가량 늘어날 것으로 예상됐다. 성동구 옥수동 ‘래미안 옥수 리버젠’ 전용 84㎡는 1주택자 보유세가 올해 276만5000원에서 내년 302만8000원으로 26만원(9%)가량 늘고, 마포구 아현동 ‘마포 래미안 푸르지오’ 전용 84㎡는 올해 239만3000원이던 보유세가 내년 275만1000원으로 36만원(15.0%) 정도 오르는 것으로 나타났다.",2024-11-19,2024,11,2024-11,서초구,"서초구, 송파구",1.0,1,0,긍정
"내년 공시가율 동결, 그래도 강남은 보유세 뛴다",2024.11.20 00:01,https://www.joongang.co.kr/article/25293288,"정부가 내년 부동산 공시가격의 시세 반영률(공시가격 현실화율)을 지난해에 이어 올해도 동결하기로 했다. 반포 래미안퍼스티지, 보유세 39% 올라  이날 신한은행이 서울 주요 아파트의 내년도 보유세 추정치를 분석한 결과, 올해 집값이 많이 오른 강남 3구(강남·서초·송파구)는 내년 보유세가 대체로 올해보다 20~30% 늘어나는 것으로 나타났다. 현 정부는 앞서 2023년 공시가격 현실화율을 2020년 수준인 69%(공동주택 기준)로 환원한 바 있고, 2024년 공시가격 현실화율도 동결했다.",2024-11-20,2024,11,2024-11,서초구,"서초구, 송파구",0.0,0,0,중립
집값 뛰더니 강남권 종부세 '쾅'…82만원 내던 '은마' 162만원,2024.11.26 18:04,https://www.joongang.co.kr/article/25295059,"올해 주택분 종합부동산세 납부 세액(고지 기준)은 지난해보다 1000억원 늘어나면서 비슷한 수준을 유지했지만, 집값이 크게 뛴 강남권에선 세부담이 크게 증가한 것으로 분석된다. 부동산 세금 계산 서비스 ‘셀리몬’의 시뮬레이션을 받아본 결과, 전용면적 84㎡ 기준 은마아파트(강남구 대치동)를 소유한 1세대 1주택자는 지난해 종부세로 82만원을 냈지만, 올해는 162만4000원으로 2배가량으로 늘었다. 올해도 집값이 크게 오르면서 내년엔 강남권 종부세 부담이 더욱 커질 것으로 보인다.",2024-11-26,2024,11,2024-11,강남구,강남구,-1.0,0,2,부정
방배동 ‘분상제’ 래미안·아크로 출격…12월 전국서 2만8000가구 분양,2024.12.02 15:08,https://www.joongang.co.kr/article/25296554,"한국부동산원 청약홈에 따르면 올해 분양가 상한제 지역의 평균 청약 경쟁률은 일반 지역보다 7.5배 높은 것으로 나타났다. 지난달까지 분양에 나선 분상제 단지는 44곳으로, 일반공급 1만7703가구에 총 84만8031건이 접수돼 평균 47.90대 1의 경쟁률을 보였다. 분양업계 관계자는 ""내년에도 공사비·인건비 상승 영향으로 분양 가격이 높은 수준을 보일 것으로 예상된다""며""수도권과 지방 양극화 흐름 속에 분상제 단지와 또 일반 분양 단지 간에도 흥행이 엇갈릴 것으로 보인다""고 말했다.",2024-12-02,2024,12,2024-12,서초구,서초구,1.0,3,0,긍정
탄핵 정국 속 강남 분양에 5만명 몰려…서울도 '옥석 가리기' 심화,2024.12.11 14:41,https://www.joongang.co.kr/article/25299115,11일 한국부동산원 청약홈에 따르면 서울 서초구 방배동 ‘아크로 리츠카운티’는 전날 일반공급 71가구 모집에 3만4279명이 청약해 평균 482.8대 1의 경쟁률 나타냈다. DL이앤씨가 방배삼익 아파트를 재건축하는 ‘아크로 리츠카운티’는 분양가 상한제가 적용돼 전용면적 84㎡ 기준 분양가가 20억~21억원대로 나왔다. 하반기 강북 지역 청약 최대어로 꼽혔던 노원구 월계동 ‘서울원 아이파크’가 지난달 1순위 청약에서 평균 14.9대 1의 경쟁률로 흥행이 저조했던 게 대표적이다.,2024-12-11,2024,12,2024-12,서초구,서초구,1.0,3,0,긍정
"사공 많아도 60억 로또 됐다…신도시 1기 재건축, 반포가 답유료 전용",2024.12.17 14:38,https://www.joongang.co.kr/article/25300618,"반포의 국내 최고가 아파트가 바로 통합 재건축 단지입니다. 래미안원베일리와 아크로리버파크의 같은 전용면적 최고 실거래가를 보면 전용 59㎡ 각각 38억3000만원, 36억5000만원, 전용 84㎡ 각각 60억원, 54억8000만원입니다. 신반포3차 1100여 가구로 시작한 재건축 사업 규모가 5개 단지를 아우르는 2600여 가구가 됐습니다.",2024-12-17,2024,12,2024-12,서초구,서초구,1.0,1,0,긍정
3~4인 가구는 언감생심...'강남3구' 청약 커트라인 평균 '72점',2024.12.17 14:38,https://www.joongang.co.kr/article/25300616,"서울 ‘강남 3구(강남·서초·송파구)’ 청약 당첨에 필요한 가점이 평균 72점(84점 만점)에 달하는 것으로 나타났다. 17일 분양평가 회사 리얼하우스가 한국부동산원 청약홈의 당첨 가점을 조사한 결과, 올해 7개 단지가 분양에서 나선 ‘강남 3구’에서는 주택 유형별 가점 커트라인은 평균 72점이었다. 리얼하우스 관계자는 ""지난해 추첨 물량이 대폭 늘어난 데 이어 올해 신생아 특별공급, 신생아 우선 공급 등 청년층을 대상으로 한 분양 물량이 증가해 중장년층은 청약 기회가 줄었다""며 ""이에 높은 가점을 보유한 중장년층이 가점제로 몰리면서 당첨 커트라인은 올라간 것으로 보인다""고 분석됐다.",2024-12-17,2024,12,2024-12,송파구,송파구,1.0,3,0,긍정
강남 청약 커트라인 평균 72점…4인 가구도 당첨은 ‘그림의 떡’,2024.12.18 00:02,https://www.joongang.co.kr/article/25300765,서울 강남 3구(강남·서초·송파구) 청약 당첨에 필요한 가점이 평균 72점(84점 만점)에 달하는 것으로 나타났다. 17일 분양평가회사 리얼하우스가 한국부동산원 청약홈의 당첨 가점을 조사한 결과 올해 7개 단지가 분양에서 나선 강남 3구에서는 주택 유형별 가점 커트라인은 평균 72점이었다. 지방의 일반분양(6만295가구) 청약자(37만9168명)보다 강남 3구 청약자가 더 많았다.,2024-12-18,2024,12,2024-12,송파구,송파구,1.0,3,0,긍정
"""대치동 학원 유치"" ""2억 보장""…한남4구역 잡기 파격 수주전",2024.12.22 06:00,https://www.joongang.co.kr/article/25301834,"서울 용산구 보광동 ‘한남4구역’ 재개발 사업 시공권을 두고 맞붙은 업계 1·2위(시공능력평가 기준) 삼성물산 건설부문과 현대건설의 경쟁이 과열 분위기다. 삼성물산 측은 ""특허 출원한 디자인으로 조합원 100% 한강 조망권을 확보했다""고 설명했다. 한남4구역 재개발 사업은 서울 용산구 보광동 360일대에 지하 7층~지상 22층, 51개 동, 2331가구를 짓는 사업이다.",2024-12-22,2024,12,2024-12,강남구,강남구,-0.3333333333333333,1,2,부정
“대치동 학원 유치” “공사비 절감”…한남 4구역 잡기 파격 수주전,2024.12.23 00:02,https://www.joongang.co.kr/article/25301967,"현대건설은 평당 공사비 881만4300원, 총 공사비 1조4855억원을 제시했다. 삼성물산은 평당 공사비 938만3000원, 총 예정 공사비 1조5695억원을 내놓았다. 또 다른 관계자는 ""경쟁 과정에서 무리하게 제시한 조건들이 조합원들의 눈높이를 높여 놓았는데, 그대로 적용하기 어려운 조건들도 있어 자칫하면 향후 갈등의 소지가 될 수 있다""고 덧붙였다.",2024-12-23,2024,12,2024-12,강남구,강남구,0.0,0,0,중립
수도권 아파트값 8개월 만에 하락…서울은 자치구 절반 상승 스톱,2024.12.26 16:38,https://www.joongang.co.kr/article/25303018,26일 한국부동산원에 따르면 이번 주 수도권 아파트값은 0.02% 내리며 4월 넷째 주(-0.01%) 이후 약 8개월 만에 하락세로 돌아섰다. 이번 주 0.01% 상승한 서울의 경우 25개 자치구 가운데 금천·중랑·동대문(이상 -0.03%)·노원·구로(이상 -0.02%)·도봉·성북·은평·강북·관악구(-0.01%) 등 10곳이 하락한 것으로 조사됐다. 하지만 강남(0.03%)·서초(0.06%)·송파구(0.04%) 등 ‘강남 3구’의 아파트값은 지난주와 비슷한 상승세를 이어갔다.,2024-12-26,2024,12,2024-12,송파구,송파구,0.0,1,1,중립
"탄핵정국, 치명타였나…수도권 아파트 가격 8개월 만에 하락 전환",2024.12.27 00:03,https://www.joongang.co.kr/article/25303138,"26일 한국부동산원에 따르면 이번 주 수도권 아파트값은 0.02% 내리며 4월 넷째 주(-0.01%) 이후 약 8개월 만에 하락세로 돌아섰다. 서울은 25개 자치구 가운데 금천·중랑·동대문(이상 -0.03%)·노원·구로(이상 -0.02%)·도봉·성북·은평·강북·관악구(-0.01%) 등 10곳이 하락한 것으로 조사됐다. 서울에선 1만2032가구 규모의 올림픽파크포레온 입주 영향으로 송파구와 강동구(각 -0.03%)의 전셋값 하락세가 이어졌고, 성동구는 0.06% 하락해 4주 연속 약세가 지속했다.",2024-12-27,2024,12,2024-12,송파구,송파구,0.0,1,1,중립
서울 아파트 매매가격 오름세 41주만에 멈춰…전국 하락세 지속,2025.01.02 16:58,https://www.joongang.co.kr/article/25304708,"송파구(0.06%), 서초구(0.03%), 용산·강남·종로·성동·강서구(0.02%), 양천구(0.01%) 등은 상승세를 유지했으나 강동(0.00%→-0.02%), 동작(0.00%→-0.01%) 등은 하락 전환했고, 금천(-0.03%→-0.05%), 구로(-0.02%→-0.04%), 은평·강북·도봉·관악(-0.01%→-0.02%) 등은 낙폭을 확대했다. 경기도는 전주와 마찬가지로 0.02% 내리고, 인천도 0.09% 하락하며 수도권(-0.02%) 아파트값도 2주째 하락했다. 수도권(-0.01%→0.00%)은 보합 전환했으며 서울(0.00%→0.00%)은 보합 유지, 지방(0.00%→-0.01%)은 하락 전환으로 각각 조사됐다.",2025-01-02,2025,1,2025-01,서초구,"서초구, 송파구",0.0,1,1,중립
올해 알짜 청약단지는…이달 방배동 ‘래미안 원페를라’ 출격,2025.01.06 17:03,https://www.joongang.co.kr/article/25305484,지난해는 분양가 상한제가 적용되는 서울 강남 3구(강남·서초·송파구)에서 ‘로또급’ 청약이 잇따르며 한해 내내 청약 시장을 달궜다. 당장 이달 중순 삼성물산 건설부문이 서초구 방배동에서 방배6구역 재개발을 통해 조성하는 ‘래미안 원페를라’가 분양에 나선다. 하반기에는 서초구 반포동·방배동에서 주요 단지가 출격할 예정이다.,2025-01-06,2025,1,2025-01,서초구,"서초구, 송파구",1.0,3,0,긍정
서초·송파 대어급 단지 분양 임박…올해 알짜 청약은 어디?,2025.01.07 00:02,https://www.joongang.co.kr/article/25305554,6일 정비업계에 따르면 올해는 강남권에서 지난해 만큼 많은 물량은 아니지만 상·하반기에 2~3곳씩 대어급 단지가 출격한다. 당장 이달 중순 삼성물산 건설부문이 서초구 방배동에서 방배6구역 재개발을 통해 조성하는 ‘래미안 원페를라’가 분양에 나선다. 지난해 인근에서 분양했던 ‘디에이치 방배’(방배5구역)가 3.3㎡당 약 6500만원에 나온 것을 고려하면 분양가는 비슷하거나 약간 더 비싸게 나올 수 있다.,2025-01-07,2025,1,2025-01,서초구,서초구,1.0,3,0,긍정
방배·잠실 ‘7억 로또’ 신호탄…올해 대박 날 지역은 여기다유료 전용,2025.01.07 17:06,https://www.joongang.co.kr/article/25305812,2019년까지 7억원 이하였던 노원구 전용 84㎡ 분양가도 지난해 11월 14억원에 육박했습니다    분양가 고공행진에도 지난해 분양시장에 청약자가 몰린 것은 강남을 중심으로 분양가 규제를 받는 상한제 로또가 잇따라 나온 영향이 큽니다. 분양가는 지난해 8월 분양한 인근 방배5구역 재건축 단지인 디에이치방배(3.3㎡당 6500만원)과 비슷할 것으로 예상합니다. 용산 상한제 분양가는 2023년 7월 분양한 국제빌딩5구역 재개발 단지인 용산호반써밋에이디션 3.3㎡당 4400만원이 최근 가격입니다.,2025-01-07,2025,1,2025-01,송파구,송파구,0.6,4,1,긍정
"콧대 높던 강남 집값도 꺾였다…""1억~2억 낮춘 급매만 팔려""",2025.01.12 16:11,https://www.joongang.co.kr/article/25306877,정부의 대출 규제가 지속되고 윤석열 대통령에 대한 탄핵 정국이 장기화하면서 기세등등하던 서울 강남구 아파트값도 상승세가 멈췄다. 아파트값 하락세가 주요 지역까지 확대되면서 서울 아파트 평균 매매가격도 1년8개월 만에 10억원 아래로 내려왔다. 실제 서울 아파트 거래량은 작년 7월 9216건을 기록한 뒤 대출 규제가 본격화한 9월부터 3000건대로 뚝 떨어졌다(서울부동산정보광장).,2025-01-12,2025,1,2025-01,강남구,강남구,-0.5,1,3,부정
