title,date,url,content,parsed_date,year,month,year_month,region,districts,sentiment_score,positive_count,negative_count,sentiment_label
5억 날린 30대 영끌족 울 때…‘10억 대박’ 쥔 헬리오 그들유료 전용,2023.10.25 15:25,https://www.joongang.co.kr/article/25202174,"입주 후 매머드급 위용만큼 인기를 끌다 2021년 말 이후 금리 급등 직격탄을 맞아 수억원을 손해보고 되파는 손절매가 잇따랐습니다. 올해 아파트 매매 거래량이 지난해 전체 대비 서울 140%, 송파구 240% 늘어났습니다. 송파구 전체로 보면 매수자 지역이 같은 송파구가 36%, 서울시내 다른 구가 34%, 서울 이외가 30%입니다.",2023-10-25,2023,10,2023-10,송파구,송파구,0.6,4,1,긍정
'미니 신도시' 개포동에 희소가치 높은 소형 아파트 신규 분양,2023.10.27 14:24,https://www.joongang.co.kr/article/25202790,"공급 가뭄이 심한 강남 요지에 희소가치가 높은 알짜 소형 주거상품이 올해 첫 신규 분양한다. 대우건설은 자회사 대우에스티를 통해 다음 달 서울 강남구에서 '대치 푸르지오 발라드'를 분양할 예정이라고 27일 밝혔다. 대치동 일대에서 개포우성·선경·한보미도맨션 등 대규모 재건축이 진행될 예정이고, 개포동은 대규모 브랜드 단지가 밀집한 신도시로 형성되고 있다.",2023-10-27,2023,10,2023-10,강남구,강남구,1.0,2,0,긍정
"""추가 공사비 2168억원 달라""…재건축 가로막는 ‘공사비 갈등’",2023.11.01 17:36,https://www.joongang.co.kr/article/25204022,"1일 부동산 업계 등에 따르면 2678가구를 짓는 ‘잠실 진주아파트’ 재건축 사업의 시공사인 삼성물산과 HDC현대산업개발은 지난 8월 재건축조합에 평당 공사비를 660만원에서 898만원으로 인상해 달라고 요청했다. 시공사 측은 문화재 발굴 등으로 지연이 발생했고, 공사원가 급등, 설계변경에 따른 추가 공사비 발생 등으로 공사비 인상과 공사 기간 연장이 불가피하다는 입장이다. 한 조합원은 ""높은 공사비 인상과 공사 기간 연장을 받아들일 수 없어 집행부에 시공사와 강력한 협상을 요청한 상황""이라며 ""모든 인상 요인을 조합원에게 떠넘기는 건 황당한 요구""라고 말했다.",2023-11-01,2023,11,2023-11,송파구,송파구,1.0,3,0,긍정
11월 전국 아파트 4만 가구 분양…알짜 분양 단지는 어디,2023.11.01 14:11,https://www.joongang.co.kr/article/25203928,올해 상반기 부동산 시장이 침체되며 미뤄진 분양 물량이 하반기 들어 쏟아지고 있다. 송파구 문정동 ‘힐스테이트e편한세상문정’(1265가구)으로 일반분양 물량은 49㎡·59㎡·74㎡ 타입 299가구다. 송파구 아파트를 동대문구 아파트 가격으로 분양받을 수 있는 셈이다.,2023-11-01,2023,11,2023-11,송파구,송파구,0.0,1,1,중립
"건산연 “내년 집값 2% 하락, 전셋값 2% 상승” 전망",2023.11.01 17:28,https://www.joongang.co.kr/article/25204018,"김성환 한국건설산업연구원 부연구위원은 1일 서울 강남구 건설회관에서 열린 ‘2024년 건설·부동산 경기 전망 세미나’에서 ""내년에는 정책 대출을 포함해 전반적으로 대출 경직성이 강화되고, 고금리 장기화가 예상되면서 주택 시장이 다시금 하락 반전할 것""이라고 내다봤다. 김 부연구위원은 먼저 ""올해 3분기까지 시장 흐름은 연초 최저가 매물이 소진되며 저점을 보인 후 특례보금자리론, 장기 주택담보대출 등 주택 시장에 유동성이 예상보다 크게 공급돼 수도권을 중심으로 상승세가 나타났다""고 분석했다. 김 부연구위원은 ""구매 심리가 회복되긴 했지만 연초 대비 부담스러운 가격 수준, 고금리 장기화 우려, 대출 축소, 경기 둔화 등의 영향으로 올해 수준의 거래량이 내년까지 지속되긴 어려울 것""이라고 말했다.",2023-11-01,2023,11,2023-11,강남구,강남구,-0.2,2,3,부정
원자잿값·인건비 인상에 고금리까지…재건축이 멈춰선다,2023.11.02 00:02,https://www.joongang.co.kr/article/25204123,"서울 송파구 신천동 ‘잠실 진주아파트’ 재건축 사업이 공사비를 둘러싼 조합과 시공사 간 갈등으로 표류하고 있다. 1일 부동산 업계 등에 따르면 2678가구를 짓는 ‘잠실 진주아파트’ 재건축 사업의 시공사인 삼성물산과 HDC현대산업개발은 지난 8월 재건축조합에 3.3㎡당 공사비를 660만원에서 898만원으로 인상해 달라고 요청했다. 한 조합원은 ""높은 공사비 인상 등을 받아들일 수 없어 집행부에 시공사와 강력한 협상을 요청한 상황""이라며 ""모든 인상 요인을 조합원에게 떠넘기는 건 황당한 요구""라고 말했다.",2023-11-02,2023,11,2023-11,송파구,송파구,0.3333333333333333,2,1,긍정
"""日에 롯폰기 힐스 모리미술관 있다면…"" 아트컨설팅 OKNP 대표의 꿈",2023.11.03 00:03,https://www.joongang.co.kr/article/25204425,"인터뷰 이옥경 OKNP 대표     토탈 아트 솔루션 제공 경험 풍부  운동선수 등 속속 미술시장 유입  강남권 예술 메카로 성장 가능성                                 맥도날드를 세계적 프랜차이즈 브랜드로 키워낸 레이 크록은 1974년 한 대학교 강연에서 자신이 부동산업에 종사한다고 밝혔다. 이 부회장이 최근 서울 서초구 반포동의 ‘더 팰리스 73’ 리테일 시설에 OKNP 갤러리 입점을 확정하고 토탈 아트 케어 서비스를 제공하는 갤러리를 운영하기로 한 것 역시 같은 맥락이다. OKNP는 더 팰리스 73 갤러리에서 다양한 전시 운영과 더불어 입주민들을 대상으로 아트테크를 포함한 전문적인 문화강좌나 문화체험 관련 프로그램을 진행할 예정이며 미술품 감정, 구매, 판매와 관련한 차별화된 토탈 아트 케어 서비스를 제공할 계획이다"".",2023-11-03,2023,11,2023-11,서초구,서초구,1.0,1,0,긍정
"부동산 800억 현금으로 샀다…당신네들, 직업이 뭡니까?유료 전용",2023.11.08 14:51,https://www.joongang.co.kr/article/25205704,그는 타워팰리스를 사서 들어가기 전에는 경기도 성남시 분당의 랜드마크 초고층 주상복합인 파크뷰에 살았습니다. 그해 9월 강남구 청담동 더펜트하우스청담 이전 공시가격 1위를 줄곧 차지하고 있던 서초구 서초동 트라움하우스 5차를 185억원에 대출 없이 구입했습니다. 지난해 9월 갤러리아포레 옆 초고층 주상복합인 아크로서울포레스트 47층 펜트하우스 264㎡를 130억원에 매입한 전지현은 타워팰리스와 함께 대표적인 강남 초고층 단지인 강남구 삼성동 아이파크 175㎡를 2005년 매입하기도 했습니다.,2023-11-08,2023,11,2023-11,강남구,"강남구, 서초구",-1.0,0,1,부정
"청담 그곳도 6채 중 1채 매물…거래 확 줄었다, 집값 하락 전조?",2023.11.09 16:48,https://www.joongang.co.kr/article/25206075,"9일 중앙일보가 포털사이트 네이버 부동산에 올라온 매물 정보를 지난 6~8일에 걸쳐 웹 크롤링 방식(웹사이트에서 정보 추출)으로 수집해 분석한 결과, 서울 아파트 182만2514가구 중 7만9004가구(4.33%·중복 매물 제외)가 네이버 부동산에 매물로 등록된 것으로 나타났다. 아실에 따르면 지난 3일 서울 아파트 매물 수는 8만452건을 기록했는데, 이는 관련 조사를 시작한 이래 가장 많은 수치다. 올해 초부터 집값 반등세가 나타나면서 매도자는 조금이라도 더 비싼 가격에 판매하려고 하지만, 매수자는 올해 초 급매물 가격에 집을 사길 희망한다는 것이다.",2023-11-09,2023,11,2023-11,강남구,강남구,-0.3333333333333333,1,2,부정
女농구 전주원 186억 대박…청담동 꼬마빌딩 242억에 팔았다,2023.11.09 19:00,https://www.joongang.co.kr/article/25206131,이 건물은 전주원 부부가 구입해 재건축한 꼬마빌딩이다. 전주원 부부는 이전에 살던 구의동 아파트를 팔고 이 건물 4층 주택으로 들어와 살았다. 전주원 부부의 건물을 구입한 사람은 이동혁 전 고려해운 회장으로 나타났다.,2023-11-09,2023,11,2023-11,강남구,강남구,1.0,1,0,긍정
아파트 거래 뚝…6채 중 1채꼴 매물 나온 단지도,2023.11.10 00:02,https://www.joongang.co.kr/article/25206180,"9일 중앙일보가 포털사이트 네이버 부동산에 올라온 매물 정보를 지난 6~8일에 걸쳐 웹 크롤링 방식(웹사이트에서 정보 추출)으로 수집해 분석한 결과, 서울 아파트 182만2514가구 중 7만9004가구(4.33%·중복 매물 제외)가 네이버 부동산에 매물로 등록된 것으로 나타났다. 아실에 따르면 지난 3일 서울 아파트 매물 수는 8만452건을 기록했는데, 이는 관련 조사를 시작한 이래 가장 많다. 500가구 이상인 서울 아파트의 총 가구수 대비 매물 비율을 측정해보니 강남구 청담자이(17.66%), 서초구 반포주공1단지(12.8%), 성동구 트리마제(11.6%), 구로구 한양수자인에듀힐스(11.4%) 순으로 나타났다.",2023-11-10,2023,11,2023-11,강남구,"강남구, 서초구",0.0,0,0,중립
"수영장 주인만 125명이다, ‘입지깡패’ 신반포4차 함정유료 전용",2023.11.13 16:30,https://www.joongang.co.kr/article/25206854,"김씨는 ""반포·잠원은 ‘고터’(고속버스터미널) 주변이 메인 입지라 오히려 반포주공1단지 쪽을 외졌다고 보는 시각이 있다""며 ""신반포4차가 재건축되면 반포 대장주인 래미안원베일리도 위협할 것""이라고 말했습니다. 대형 평수 소유주의 반대, 세계 금융위기, 뉴코아쇼핑센터 상가 소유주와의 갈등, 아파트 단지 뒤편 수영장 부지 통합 등으로 우여곡절을 겪으면서 재건축이 오랫동안 지연된 겁니다. 주변의 다른 중개업소 소장은 ""손님들이 신반포2차와 비교하는 경우가 많은데 한강 조망을 원하면 신반포2차를, 생활 편의성을 중시하면 신반포4차를 선택한다""며 ""지금이야 한강 조망권이 부각돼 신반포2차 가격이 높지만, 10년 전만 해도 입지가 좋은 신반포4차가 좀 더 비쌌다""고 했습니다.",2023-11-13,2023,11,2023-11,서초구,서초구,0.0,1,1,중립
"강남 청약 30평대 사라졌다, 몰래 남겨둔 ‘29가구의 비밀’유료 전용",2023.11.15 14:32,https://www.joongang.co.kr/article/25207450,"현행 법령에 따르면 재건축은 85㎡ 이하를 전체 건립 가구 수의 60% 이상, 재개발은 80% 이상 짓게 돼 있습니다. 신반포4지구 재건축은 전체 건립 가구가 3307가구이고 85㎡ 이하가 75%인 2482가구입니다. 앞에서 봤듯 85㎡ 초과가 이문1구역 재개발에선 전체 건립 가구 수의 3%밖에 안 되는데도 일반분양분으로 나왔지만 신반포4지구의 경우 25%나 되는데도 일반분양분이 없습니다.",2023-11-15,2023,11,2023-11,서초구,서초구,1.0,4,0,긍정
상승 멈춘 강남구 아파트…“집값 단기 조정” vs “대세 하락”,2023.11.20 00:03,https://www.joongang.co.kr/article/25208439,"지난달 서울 아파트 실거래가격이 9개월 만에 상승세가 꺾이면서 부동산 시장이 조정 국면에 들어선 것 아니냐는 전망이 나온다. 특히 정부의 대출 규제와 고금리 기조 속에 지난해 하반기에 이어 부동산 ‘2차 하락’이 현실화하는 것 아니냐는 불안감이 고개를 들고 있다. 그는 ""작년 이맘땐 부동산 프로젝트파이낸싱(PF)발 위기가 현실화하며 집값 급락을 불렀지만 올해는 정부의 개입 하에 비교적 양호하게 관리되고 있다""며 ""내년 신생아 특례대출, 아파트 입주량 최저 등 집값을 자극할 수 있는 요인이 많다""고 설명했다.",2023-11-20,2023,11,2023-11,강남구,강남구,-0.6,2,8,부정
공시가 현실화율 동결에도…잠실5단지 보유세 439만→633만원,2023.11.21 16:05,https://www.joongang.co.kr/article/25208916,"올해 집값 상승세와 맞물려 보유세(재산세+종합부동산세) 과세 기준이 되는 공시가격이 지난해보다 오를 것으로 전망돼서다. 21일 한국부동산원에 따르면 올해 들어 지난 9월까지 전국 아파트 실거래가지수는 5.74% 올랐다. 우병탁 부지점장은 ""올해 집값이 떨어진 연립·다세대나 지방 아파트는 내년 보유세가 올해보다 줄어들 가능성이 있다""고 말했다.",2023-11-21,2023,11,2023-11,송파구,송파구,1.0,1,0,긍정
"집값 하락세 신호탄…미성 -1억 파크리오 -2억, 강남이 꺾였다",2023.11.23 16:43,https://www.joongang.co.kr/article/25209587,"서울 집값의 ‘바로미터’로 통하는 강남구 아파트값(-0.02%)이 지난 4월 17일 이후 31주 만에 마이너스 변동률을 기록했다. 송파구 신천동 ‘파크리오’ 전용 84㎡도 이달 초 19억2000만원에 거래돼, 지난달 거래가격(20억~21억원대)보다 1억~2억원 하락했다. 박원갑 KB국민은행 부동산 수석전문위원은 ""강남구는 물론 인근 서초·송파구를 비롯해 전국적으로 집값 하락세가 확산할 것""이라며 ""다만 주택 공급 부족 불안 심리와 분양가 상승 등 요인으로 지난해처럼 급락하진 않을 것 같다""고 말했다.",2023-11-23,2023,11,2023-11,강남구,"강남구, 송파구",-0.2,2,3,부정
강남구도 7개월 만에 내렸다…서울 집값 하락세 확산,2023.11.24 00:02,https://www.joongang.co.kr/article/25209704,"서울 집값의 ‘바로미터’로 통하는 강남구 아파트값(-0.02%)이 지난 4월 17일 이후 31주 만에 마이너스 변동률을 기록했다. 송파구 신천동 ‘파크리오’ 전용 84㎡도 이달 초 19억2000만원에 거래돼, 지난달 거래가격(20억~21억원대)보다 1억~2억원 하락했다. 박원갑 KB국민은행 부동산 수석전문위원은 ""강남구는 물론 서초·송파구를 비롯해 전국적으로 집값 하락세가 확산할 것""이라며 ""다만 주택 공급 부족 불안 심리와 분양가 상승 등 요인으로 지난해처럼 급락하진 않을 것 같다""고 말했다.",2023-11-24,2023,11,2023-11,강남구,"강남구, 송파구",-0.2,2,3,부정
강남 청약 30평대 사라졌다…몰래 남겨둔 '29가구의 비밀' [부동산? 부동산!],2023.11.24 05:00,https://www.joongang.co.kr/article/25209803,"전체 건립 가구에 84㎡가 103가구 있었지만 일반분양분으로 나온 건 없었다. 내년에 분양할 것으로 보이는 강남구 도곡동 도곡삼호, 청담동 청담삼익, 서초구 방배동 방배6구역, 송파구 신천동 잠실진주 모두 일반분양분 중 가장 큰 주택형이 84㎡다. 그런데 동대문구 이문동 이문1구역 재개발의 경우 85㎡ 초과가 전체 건립 가구 수 3069가구의 3%밖에 안 되는데도 일반분양분이 나왔지만, 신반포4지구 재건축은 전체 3307가구 중 25%나 되는데도 일반분양분이 없다.",2023-11-24,2023,11,2023-11,강남구,"강남구, 서초구, 송파구",1.0,4,0,긍정
"“10년뒤 개포 대장은 경우현” 단, 1월에 생긴 치명적 단점유료 전용",2023.11.27 17:24,https://www.joongang.co.kr/article/25210440,"특히 인접한 개포 주공 1~4단지가 대부분 10평대 5층 규모의 국민주택으로 지어졌기 때문에 최소 평형이 30평부터 시작해 60평에 이르는 경·우·현 단지는 개포동의 부촌 단지였던 거지요. 경·우·현 단지 인근의 A 공인중개업소 대표 최모씨는 ""개포동은 대치동보다 싼 시세로 살면서 대치동 학원가를 이용할 수 있어 실속 있는 학부모들이 많이 이사 온다""며 ""경·우·현 단지는 개일초, 구룡중, 개포고가 도보권에 있어 특히 인기가 좋다""고 말했습니다. 앞으로 7~8년간은 ‘디퍼아’가 개포 대장주겠지만, 경·우·현이 재건축한 뒤에는 바로 앞에 양재천이 흐르고, 보행교만 건너면 대치동에 가닿는 경·우·현이 개포동 대장 아파트가 될 것이란 전망이 많습니다.",2023-11-27,2023,11,2023-11,강남구,강남구,1.0,2,0,긍정
전국 아파트값 5개월만에 하락…서울도 상승세 멈춰,2023.11.30 14:00,https://www.joongang.co.kr/article/25211363,"30일 한국부동산원에 따르면 이번 주(27일 기준) 전국 아파트값은 한 주 새 0.01% 내렸다. 서초구와 동작구, 서대문구 아파트값이 0.02%씩 하락 전환했고 종로·마포구(-0.01%)도 내림세로 돌아섰다. 부동산 빅데이터 업체 ‘아실’이 집계한 서울 아파트 매물 건수는 30일 기준 7만8490건으로, 6개월 전보다 26.4% 늘었다.",2023-11-30,2023,11,2023-11,서초구,서초구,0.0,1,1,중립
"수영장 주인만 125명이다, '입지깡패' 신반포4차 함정 [돈 버는 아파트 완전정복]",2023.12.01 05:00,https://www.joongang.co.kr/article/25211569,"중앙일보 프리미엄 디지털 구독서비스 더중앙플러스의 ‘돈 버는 아파트 완전정복’이 서울의 재건축 추진 아파트를 꾸준히 파헤치는 이유다. 1979년 10월 서울 서초구 잠원동에 들어선 신반포4차 아파트를 부동산 전문가와 현지 공인중개사, 재건축조합장, 주민을 인터뷰해 재건축 투자 가치 등을 집중 분석했다. ‘돈 버는 아파트 완전정복’은 투자자라면 놓쳐선 안 될 재건축 추진 단지를 선별하고, 투자 가치를 판단할 안목을 키우는 데 초점을 맞춘다.",2023-12-01,2023,12,2023-12,서초구,서초구,1.0,3,0,긍정
"영화·골프·수영·볼링 다 있다…호텔도 우습다, 이게 디퍼아유료 전용",2023.12.04 17:45,https://www.joongang.co.kr/article/25212233,"더중앙플러스가 입주를 하루 앞둔 지난달 29일 국내 아파트 가운데 최대·최고급 스케일을 자랑한다는 ‘디퍼아’의 커뮤니티 시설과 가구 내부를 국내 언론 처음으로 영상에 담아봤습니다. 최근 입주를 완료한 서울 서초구 반포동 대장 아파트 ‘래미안 원베일리’는 한강을 조망할 수 있는 전망라운지 ‘스카이 브리지’가, 올해 2월 개포 주공 4단지가 재건축된 ‘개포 프레지던스 자이’는 아파트 옥상에 설치된 인피니티 풀이 화제였습니다. 디퍼아만큼은 아니지만 2019년 입주한 래미안 블레스티지(옛 개포 주공 2단지), 디에이치 아너힐즈(주공 3단지)와 올해 2월 입주한 개포 프레지던스 자이(주공 4단지)로도 유입이 늘고 있는 건데요.",2023-12-04,2023,12,2023-12,서초구,서초구,1.0,2,0,긍정
"도곡 3억, 고덕 1억 '뚝'…서울 아파트값도 7개월만에 내렸다",2023.12.07 14:54,https://www.joongang.co.kr/article/25213055,"서울 아파트값이 7개월 만에 하락세로 돌아섰고, 경기도 역시 6개월 만에 내렸다. 7일 한국부동산원에 따르면 이번 주(4일 기준) 서울 아파트값은 전주보다 0.01% 내렸다. 이미 하락세로 전환한 강북구(-0.06%)와 강남구(-0.05%), 구로구(-0.04%), 마포·동작·도봉구(-0.03%) 등이 이번 주에도 내렸고 금천구(-0.06%), 은평구(-0.02%), 강서구(-0.01%)는 하락 지역으로 새로 편입했다.",2023-12-07,2023,12,2023-12,강남구,강남구,-1.0,0,1,부정
"부동산 관심 없다던 유재석, 200억 전액 현찰 꺼내게 한 땅",2023.12.12 15:26,https://www.joongang.co.kr/article/25214168,"방송인 유재석이 서울 강남구 논현동 토지와 건물 등 200억원 상당의 부동산을 전액 현금으로 사들인 것으로 전해졌다. 12일 대법원 등기소 등기내역과 업계에 따르면 유재석은 최근 서울 강남구 논현동 토지와 인근 4층 규모 다세대주택(빌라)를 각각 116억원, 82억원에 사들였다. 해당 토지와 다세대주택은 유재석의 소속사 안테나 사옥이 위치한 인근으로 토지면적이 각각 298.5㎡(90.3평), 275.2㎡(83.2평)다.",2023-12-12,2023,12,2023-12,강남구,강남구,0.0,0,0,중립
전국 아파트값 하락폭 확대…서울 강남구 등 23개구 하락,2023.12.14 15:44,https://www.joongang.co.kr/article/25214804,"특히 경기 지역(-0.01%→-0.05%) 낙폭이 컸고, 서울(-0.01%→-0.03%)도 약세를 보인 지역이 늘었다. 서울은 25개 자치구 중 성동구(0.05%→0.03%)와 영등포구(0.04%→0.02%)를 제외한 나머지 지역이 모두 하락세를 보였다. 경기 지역은 지역별로 혼조세를 보이는 가운데 안양 동안구(0.04%), 수원 영통구(0.04%), 광명시(0.04%)는 상승했지만 동두천시(-0.19%), 안산 상록구(-0.16%), 광주시(-0.14%), 고양 일산서구(-0.13%), 수원 장안구(-0.13%) 등은 집값이 많이 내렸다.",2023-12-14,2023,12,2023-12,강남구,강남구,0.0,1,1,중립
부동산 한파에도 여긴 ‘핫팩’…신고가 갈아치운 재건축 3곳유료 전용,2023.12.18 16:30,https://www.joongang.co.kr/article/25215642,"그런데 최근 서울 아파트 시장이 지난해 말에 이어 ‘2차 가격 조정기’에 진입했지만 압구정, 여의도, 목동 등 주요 재건축 단지에선 최고가 행진이 이어지는 등 상반된 분위기를 보이고 있습니다. 서울 부동산 시장이 하락 전환한 10월 이후에도 여의도 재건축 아파트에서만 8건의 최고가 거래가 이뤄졌습니다. 김제경 투미부동산컨설팅 소장은 ""주요 재건축 지역이 서울시의 신통기획에 의존하고 있는데, 신통기획은 말 그대로 인허가를 빨리 내주겠다는 것으로 사업시행인가까지의 시간이 줄어들 수 있지만, 관리처분인가를 받는 것은 조합원들 몫""이라며 ""재건축 추진 속도를 높이기 위해서는 조합원들의 의지가 가장 중요하다""고 설명했습니다.",2023-12-18,2023,12,2023-12,강남구,강남구,-0.2,2,3,부정
재건축 부담금 줄여준다더니…반포현대 “2억 더 내라고요?”유료 전용,2023.12.20 15:06,https://www.joongang.co.kr/article/25216274,면제금액과 부과구간이 당초 정부 완화안보다 내려가면서 부담금 부과 대상 단지들은 당초 기대보다 부담금 감소 폭이 줄어들게 됐습니다. 기존 방식에 따라 통지된 조합원당 평균 부담금 예정액이 4억원이 넘는 서울시내 4개 단지를 대상으로 시뮬레이션한 결과 정부 완화안으론 평균 17% 줄어들었습니다. 반포3주구의 부담금 예정액 4억200만원으로 시뮬레이션해 보면 당초 정부 완화안으론 3억1700만원인데 국회를 통과한 최종안으로는 3억47000만원으로 3000만원 정도 늘어납니다.,2023-12-20,2023,12,2023-12,서초구,서초구,1.0,2,0,긍정
"김강우 55억 받길 원했던 강남 건물, 45억에 매각 왜",2023.12.22 11:34,https://www.joongang.co.kr/article/25216902,"22일 경제 매체 머니투데이에 따르면 김강우는 지난 10월 31일 서울 서초구 한 건물의 매각을 마쳤다. 김강우는 2021년 자신이 대표로 있는 법인 명의로 이 건물을 32억원에 사들였고, 이듬해인 2022년 12월 리모델링을 했다. 업계에 따르면 당초 김강우는 이 건물을 55억원에 팔고 싶어했지만, 이어진 부동산 시장 침체로 가격을 10억원 낮춰 팔았다고 한다.",2023-12-22,2023,12,2023-12,서초구,서초구,-1.0,0,1,부정
“송파 갈아타기엔 여기가 딱” 녹물 나오는 아파트의 반전유료 전용,2023.12.25 15:43,https://www.joongang.co.kr/article/25217330,"양재대로는 서울 서초구 양재동에서 강남구 개포·일원동을 지나 송파구 가락(헬리오시티)·송파(가락삼익)·오금(오금현대)·방이동(올림픽선수기자촌)으로 연결되는 20㎞ 구간입니다. 1990년 말 기준 오금현대 전용 84㎡ 매매가격은 2억~2억5000만원대로, ‘올림픽 3대장’ 중 하나인 올림픽훼밀리타운 전용 84㎡ 몸값과 비슷했습니다. 추가 분담금은 정비계획안이 확정되지 않은 사업 초기라 추정하기 어렵지만, 전용 84㎡가 동일 평형으로 갈 경우 1억원 내외로 예상된다는 게 중개 업계 의견입니다.",2023-12-25,2023,12,2023-12,강남구,"강남구, 서초구, 송파구",0.0,0,0,중립
부동산 한파에도 여긴 '핫팩'…신고가 갈아치운 '재건축 삼대장',2023.12.27 05:00,https://www.joongang.co.kr/article/25217740,최근 서울 아파트 시장이 지난해 말에 이어 2차 가격 조정기에 진입했다. ◆‘사업 속도에 맞춰 신고가’ 압구정 =압구정 아파트지구는 24개 단지가 6개 특별계획구역으로 나뉘어 재건축을 진행한다. 또 그간 종 상향(2종 일반주거지→3종) 문제로 1~3단지 주민과 갈등하던 서울시가 지난 9월 종 상향 조건이던 민간임대주택 20% 이상 설치 대신 공원 조성을 수용했다.,2023-12-27,2023,12,2023-12,강남구,강남구,0.3333333333333333,2,1,긍정
